{
  "$schema": "https://json-schema.org/draft/2020-12/schema",
  "$id": "https://aico8.dev/schemas/replay-v1.schema.json",
  "title": "Aico 8 canonical replay v1",
  "type": "object",
  "additionalProperties": false,
  "required": ["schemaVersion", "replayId", "gameId", "cartSha256", "runtime", "canonicality", "trace", "requiredMilestoneIds", "milestones", "checkpoints", "result", "producer"],
  "allOf": [{
    "if": { "properties": { "canonicality": { "properties": { "inputSource": { "const": "pico8-buttons-plus-source-menuitems" } } } } },
    "then": { "required": ["hostActions"] },
    "else": { "not": { "required": ["hostActions"] } }
  }],
  "properties": {
    "schemaVersion": { "const": "aico8.replay.v1" },
    "replayId": { "$ref": "#/$defs/id" },
    "gameId": { "$ref": "#/$defs/id" },
    "cartSha256": { "$ref": "#/$defs/sha256" },
    "runtime": {
      "type": "object",
      "additionalProperties": false,
      "required": ["id", "revision"],
      "properties": {
        "id": { "$ref": "#/$defs/id" },
        "revision": { "type": "string", "minLength": 1 }
      }
    },
    "canonicality": {
      "type": "object",
      "additionalProperties": false,
      "required": ["mode", "cartMutation", "compatibilityStateMutation", "inputSource", "logicalUpdatePolicy", "testHooks", "wallClockAcceleration"],
      "properties": {
        "mode": { "const": "canonical-real-input" },
        "cartMutation": { "const": "none" },
        "compatibilityStateMutation": { "const": "none" },
        "inputSource": { "enum": ["pico8-buttons-only", "pico8-buttons-plus-source-menuitems"] },
        "logicalUpdatePolicy": { "const": "execute-all" },
        "testHooks": { "const": false },
        "wallClockAcceleration": { "type": "boolean" }
      }
    },
    "trace": { "$ref": "input-trace-v1.schema.json" },
    "hostActions": {
      "type": "array",
      "minItems": 1,
      "items": { "$ref": "#/$defs/hostAction" }
    },
    "requiredMilestoneIds": {
      "type": "array",
      "minItems": 1,
      "uniqueItems": true,
      "items": { "$ref": "#/$defs/id" }
    },
    "milestones": {
      "type": "array",
      "minItems": 1,
      "items": { "$ref": "#/$defs/milestone" }
    },
    "checkpoints": {
      "type": "array",
      "minItems": 1,
      "items": { "$ref": "#/$defs/checkpoint" }
    },
    "result": {
      "type": "object",
      "additionalProperties": false,
      "required": ["completed", "finalMilestoneId", "finalStateSha256"],
      "properties": {
        "completed": { "type": "boolean" },
        "finalMilestoneId": { "$ref": "#/$defs/id" },
        "finalStateSha256": { "$ref": "#/$defs/sha256" }
      }
    },
    "producer": {
      "type": "object",
      "additionalProperties": false,
      "required": ["name", "version", "sourceRevision"],
      "properties": {
        "name": { "type": "string", "minLength": 1 },
        "version": { "type": "string", "minLength": 1 },
        "sourceRevision": { "type": "string", "minLength": 1 }
      }
    }
  },
  "$defs": {
    "id": { "type": "string", "pattern": "^[a-z0-9][a-z0-9._-]{1,127}$" },
    "sha256": { "type": "string", "pattern": "^[a-f0-9]{64}$" },
    "hostAction": {
      "type": "object",
      "additionalProperties": false,
      "required": ["kind", "atUpdate", "index", "label", "filter", "buttons", "keepOpen"],
      "properties": {
        "kind": { "const": "source-authored-pause-menu-item" },
        "atUpdate": { "type": "integer", "minimum": 0 },
        "index": { "type": "integer", "minimum": 1, "maximum": 5 },
        "label": { "type": "string", "minLength": 1, "maxLength": 16 },
        "filter": { "type": "integer", "minimum": 0, "maximum": 63 },
        "buttons": { "type": "integer", "minimum": 0, "maximum": 63 },
        "keepOpen": { "type": "boolean" }
      }
    },
    "milestone": {
      "type": "object",
      "additionalProperties": false,
      "required": ["id", "kind", "atUpdate"],
      "properties": {
        "id": { "$ref": "#/$defs/id" },
        "kind": { "enum": ["level-complete", "progression-boundary", "ending-reached", "game-complete", "restart-complete"] },
        "atUpdate": { "type": "integer", "minimum": 1 },
        "levelOrdinal": { "type": "integer", "minimum": 1 }
      }
    },
    "checkpoint": {
      "type": "object",
      "additionalProperties": false,
      "required": ["id", "atUpdate", "hashes"],
      "properties": {
        "id": { "$ref": "#/$defs/id" },
        "atUpdate": { "type": "integer", "minimum": 0 },
        "hashes": {
          "type": "object",
          "additionalProperties": false,
          "required": ["stateSha256"],
          "properties": {
            "stateSha256": { "$ref": "#/$defs/sha256" },
            "rasterSha256": { "$ref": "#/$defs/sha256" },
            "audioSha256": { "$ref": "#/$defs/sha256" },
            "semanticSha256": { "$ref": "#/$defs/sha256" },
            "persistenceSha256": { "$ref": "#/$defs/sha256" }
          }
        }
      }
    }
  }
}
