{
  "schemaVersion": "aico8.replay.v1",
  "replayId": "synthetic.complete.v1",
  "gameId": "synthetic-fixture",
  "cartSha256": "aaaaaaaaaaaaaaaaaaaaaaaaaaaaaaaaaaaaaaaaaaaaaaaaaaaaaaaaaaaaaaaa",
  "runtime": { "id": "aico8-wasm", "revision": "fixture-revision" },
  "canonicality": {
    "mode": "canonical-real-input",
    "cartMutation": "none",
    "compatibilityStateMutation": "none",
    "inputSource": "pico8-buttons-only",
    "logicalUpdatePolicy": "execute-all",
    "testHooks": false,
    "wallClockAcceleration": true
  },
  "trace": {
    "schemaVersion": "aico8.input-trace.v1",
    "updateHz": 30,
    "totalUpdates": 8,
    "initialState": {
      "kind": "clean",
      "persistenceSha256": "bbbbbbbbbbbbbbbbbbbbbbbbbbbbbbbbbbbbbbbbbbbbbbbbbbbbbbbbbbbbbbbb"
    },
    "spans": [
      { "startUpdate": 0, "endUpdateExclusive": 2, "players": [0] },
      { "startUpdate": 2, "endUpdateExclusive": 3, "players": [2] },
      { "startUpdate": 3, "endUpdateExclusive": 7, "players": [0] },
      { "startUpdate": 7, "endUpdateExclusive": 8, "players": [16] }
    ]
  },
  "requiredMilestoneIds": ["level-01", "game-complete"],
  "milestones": [
    { "id": "level-01", "kind": "level-complete", "atUpdate": 5, "levelOrdinal": 1 },
    { "id": "game-complete", "kind": "game-complete", "atUpdate": 8 }
  ],
  "checkpoints": [
    {
      "id": "boot",
      "atUpdate": 0,
      "hashes": { "stateSha256": "cccccccccccccccccccccccccccccccccccccccccccccccccccccccccccccccc" }
    },
    {
      "id": "complete",
      "atUpdate": 8,
      "hashes": {
        "stateSha256": "dddddddddddddddddddddddddddddddddddddddddddddddddddddddddddddddd",
        "rasterSha256": "eeeeeeeeeeeeeeeeeeeeeeeeeeeeeeeeeeeeeeeeeeeeeeeeeeeeeeeeeeeeeeee"
      }
    }
  ],
  "result": {
    "completed": true,
    "finalMilestoneId": "game-complete",
    "finalStateSha256": "dddddddddddddddddddddddddddddddddddddddddddddddddddddddddddddddd"
  },
  "producer": { "name": "aico8-test", "version": "1", "sourceRevision": "fixture-revision" }
}
